{
  "schemaVersion":"plan2world-draft-v1",
  "name":"Blind sample 4 – black plan with hidden doors",
  "units":"cm",
  "scale":{"mode":"estimated","confidence":0.47,"basis":"No printed dimensions; estimated from conventional 90 cm entry-door widths and repeated door symbols."},
  "assumptions":[
    "The fire-escape corridor outside the suite is not modeled as an interior room.",
    "Circular waterbed, chair, sanitary fixtures, wardrobes and cabinetry are furniture/fixtures and are not converted to walls.",
    "Hidden-door and sliding-door labels are represented as openings in their host partitions."
  ],
  "sourceRegistration":{"floorId":"floor-0","confidence":0.88,"anchors":[
    {"wallId":"w1","endpoint":"start","image":{"x":0.177,"y":0.109}},
    {"wallId":"w1","endpoint":"end","image":{"x":0.834,"y":0.109}},
    {"wallId":"w3","endpoint":"start","image":{"x":0.834,"y":0.786}},
    {"wallId":"w3","endpoint":"end","image":{"x":0.177,"y":0.786}}
  ]},
  "floors":[{"id":"floor-0","name":"Suite","level":0,"walls":[
    {"id":"w1","start":{"x":0,"y":0},"end":{"x":700,"y":0},"thickness":20,"kind":"exterior","confidence":0.95},
    {"id":"w2","start":{"x":700,"y":0},"end":{"x":700,"y":900},"thickness":20,"kind":"exterior","confidence":0.95},
    {"id":"w3","start":{"x":700,"y":900},"end":{"x":0,"y":900},"thickness":20,"kind":"exterior","confidence":0.95},
    {"id":"w4","start":{"x":0,"y":900},"end":{"x":0,"y":0},"thickness":20,"kind":"exterior","confidence":0.95},
    {"id":"w5","start":{"x":0,"y":400},"end":{"x":700,"y":400},"thickness":12,"kind":"interior","confidence":0.96},
    {"id":"w6","start":{"x":430,"y":0},"end":{"x":430,"y":400},"thickness":12,"kind":"interior","confidence":0.95},
    {"id":"w7","start":{"x":200,"y":400},"end":{"x":200,"y":900},"thickness":12,"kind":"interior","confidence":0.86},
    {"id":"w8","start":{"x":520,"y":400},"end":{"x":520,"y":900},"thickness":12,"kind":"interior","confidence":0.88},
    {"id":"w9","start":{"x":0,"y":650},"end":{"x":200,"y":650},"thickness":12,"kind":"interior","confidence":0.83},
    {"id":"w10","start":{"x":520,"y":700},"end":{"x":700,"y":700},"thickness":12,"kind":"interior","confidence":0.84},
    {"id":"w11","start":{"x":0,"y":570},"end":{"x":200,"y":570},"thickness":12,"kind":"interior","confidence":0.78},
    {"id":"w12","start":{"x":520,"y":560},"end":{"x":700,"y":560},"thickness":12,"kind":"interior","confidence":0.76}
  ],"doors":[
    {"id":"d1","wallId":"w1","position":0.10,"width":90,"type":"single","confidence":0.94},
    {"id":"d2","wallId":"w1","position":0.90,"width":90,"type":"single","confidence":0.94},
    {"id":"d3","wallId":"w5","position":0.12,"width":85,"type":"single","confidence":0.90},
    {"id":"d4","wallId":"w5","position":0.40,"width":85,"type":"single","confidence":0.90},
    {"id":"d5","wallId":"w5","position":0.84,"width":90,"type":"sliding","confidence":0.93},
    {"id":"d6","wallId":"w3","position":0.55,"width":90,"type":"single","confidence":0.90},
    {"id":"d7","wallId":"w7","position":0.63,"width":75,"type":"single","confidence":0.72},
    {"id":"d8","wallId":"w8","position":0.72,"width":75,"type":"single","confidence":0.77}
  ],"windows":[
    {"id":"win1","wallId":"w1","position":0.50,"width":230,"type":"fixed","confidence":0.82}
  ],"furniture":[]}]
}