{"schemaVersion":"plan2world-draft-v1","name":"Wikimedia two-bedroom baseline","units":"cm","scale":{"mode":"measured","confidence":0.94,"basis":"Visible drawing dimensions: overall lower width 6900 mm, overall depth 12000 mm, upper width 6500 mm."},"assumptions":["Wall skeleton follows the visible dimension grid; the upper store/exit/kitchen split is inferred where small dimension text is hard to read.","Door and window widths that are not legible in the 535×526 source are approximate and should be corrected against the tracing underlay.","No furniture is inferred."],"sourceRegistration":{"floorId":"floor-0","confidence":0.88,"anchors":[{"wallId":"w01-top","endpoint":"start","image":{"x":0.325,"y":0.215}},{"wallId":"w01-top","endpoint":"end","image":{"x":0.621,"y":0.215}},{"wallId":"w04-right-lower","endpoint":"end","image":{"x":0.639,"y":0.77}},{"wallId":"w08-left","endpoint":"start","image":{"x":0.325,"y":0.724}}]},"floors":[{"id":"floor-0","name":"Ground Floor","level":0,"walls":[{"id":"w01-top","start":{"x":0,"y":0},"end":{"x":650,"y":0},"thickness":20,"kind":"exterior","confidence":0.98},{"id":"w02-right-upper","start":{"x":650,"y":0},"end":{"x":650,"y":400},"thickness":20,"kind":"exterior","confidence":0.95},{"id":"w03-step","start":{"x":650,"y":400},"end":{"x":690,"y":400},"thickness":20,"kind":"exterior","confidence":0.9},{"id":"w04-right-lower","start":{"x":690,"y":400},"end":{"x":690,"y":1200},"thickness":20,"kind":"exterior","confidence":0.97},{"id":"w05-porch-bottom","start":{"x":690,"y":1200},"end":{"x":340,"y":1200},"thickness":20,"kind":"exterior","confidence":0.95},{"id":"w06-notch","start":{"x":340,"y":1200},"end":{"x":340,"y":1100},"thickness":20,"kind":"exterior","confidence":0.9},{"id":"w07-left-bottom","start":{"x":340,"y":1100},"end":{"x":0,"y":1100},"thickness":20,"kind":"exterior","confidence":0.94},{"id":"w08-left","start":{"x":0,"y":1100},"end":{"x":0,"y":0},"thickness":20,"kind":"exterior","confidence":0.98},{"id":"w09-bed1-bottom","start":{"x":0,"y":400},"end":{"x":340,"y":400},"thickness":12,"kind":"interior","confidence":0.97},{"id":"w10-toilet-split","start":{"x":0,"y":550},"end":{"x":180,"y":550},"thickness":12,"kind":"interior","confidence":0.96},{"id":"w11-bed2-top","start":{"x":0,"y":700},"end":{"x":340,"y":700},"thickness":12,"kind":"interior","confidence":0.97},{"id":"w12-toilet-lobby","start":{"x":180,"y":400},"end":{"x":180,"y":700},"thickness":12,"kind":"interior","confidence":0.96},{"id":"w13-central","start":{"x":340,"y":0},"end":{"x":340,"y":1100},"thickness":12,"kind":"interior","confidence":0.98},{"id":"w14-store-exit","start":{"x":470,"y":0},"end":{"x":470,"y":240},"thickness":12,"kind":"interior","confidence":0.83},{"id":"w15-service-kitchen","start":{"x":340,"y":240},"end":{"x":650,"y":240},"thickness":12,"kind":"interior","confidence":0.84},{"id":"w16-kitchen-dining","start":{"x":340,"y":400},"end":{"x":650,"y":400},"thickness":12,"kind":"interior","confidence":0.91},{"id":"w17-dining-living","start":{"x":340,"y":550},"end":{"x":690,"y":550},"thickness":12,"kind":"interior","confidence":0.9},{"id":"w18-living-porch","start":{"x":340,"y":1000},"end":{"x":690,"y":1000},"thickness":12,"kind":"interior","confidence":0.96}],"doors":[{"id":"d01-bed1","wallId":"w09-bed1-bottom","position":0.77,"width":90,"type":"single","confidence":0.86},{"id":"d02-toilet1","wallId":"w12-toilet-lobby","position":0.25,"width":75,"type":"single","confidence":0.82},{"id":"d03-toilet2","wallId":"w12-toilet-lobby","position":0.75,"width":75,"type":"single","confidence":0.82},{"id":"d04-bed2","wallId":"w11-bed2-top","position":0.77,"width":90,"type":"single","confidence":0.78},{"id":"d05-lobby-dining","wallId":"w13-central","position":0.43,"width":90,"type":"opening","confidence":0.72},{"id":"d06-service","wallId":"w15-service-kitchen","position":0.7,"width":90,"type":"single","confidence":0.66},{"id":"d07-kitchen-dining","wallId":"w16-kitchen-dining","position":0.5,"width":120,"type":"opening","confidence":0.76},{"id":"d08-dining-living","wallId":"w17-dining-living","position":0.5,"width":140,"type":"opening","confidence":0.72},{"id":"d09-living-porch","wallId":"w18-living-porch","position":0.5,"width":150,"type":"double","confidence":0.9},{"id":"d10-exit","wallId":"w01-top","position":0.86,"width":90,"type":"single","confidence":0.78}],"windows":[{"id":"win01-bed1-top","wallId":"w01-top","position":0.18,"width":120,"type":"standard","confidence":0.86},{"id":"win02-bed1-left","wallId":"w08-left","position":0.18,"width":120,"type":"standard","confidence":0.82},{"id":"win03-bed2-left","wallId":"w08-left","position":0.82,"width":120,"type":"standard","confidence":0.86},{"id":"win04-bed2-bottom","wallId":"w07-left-bottom","position":0.5,"width":120,"type":"standard","confidence":0.82},{"id":"win05-kitchen-right","wallId":"w02-right-upper","position":0.72,"width":100,"type":"standard","confidence":0.8},{"id":"win06-living-right","wallId":"w04-right-lower","position":0.42,"width":150,"type":"standard","confidence":0.88},{"id":"win07-porch-right","wallId":"w04-right-lower","position":0.86,"width":100,"type":"standard","confidence":0.72}],"furniture":[]}]}