{
  "schemaVersion":"plan2world-draft-v1",
  "name":"Blind sample 3 – curved Lianjia apartment",
  "units":"cm",
  "scale":{"mode":"measured","confidence":0.86,"basis":"Recovered metric scale from the printed millimetre dimension chains around the plan; bottom chain totals about 16.4 m and the left chain about 15.3 m."},
  "assumptions":[
    "The draft schema only supports straight wall centerlines, so the large curved exterior façade/balcony is approximated by a polyline of straight segments.",
    "Furniture and room-area labels are used only as semantic cues and are not modeled as furniture.",
    "Several small service-room partitions and opening widths are approximate because labels and wall strokes overlap."
  ],
  "sourceRegistration":{"floorId":"floor-0","confidence":0.82,"anchors":[
    {"wallId":"w1","endpoint":"start","image":{"x":0.421,"y":0.052}},
    {"wallId":"w7","endpoint":"end","image":{"x":0.953,"y":0.495}},
    {"wallId":"w14","endpoint":"end","image":{"x":0.613,"y":0.956}},
    {"wallId":"w20","endpoint":"start","image":{"x":0.235,"y":0.575}}
  ]},
  "floors":[{"id":"floor-0","name":"Apartment","level":0,"walls":[
    {"id":"w1","start":{"x":460,"y":0},"end":{"x":760,"y":0},"thickness":20,"kind":"exterior","confidence":0.9},
    {"id":"w2","start":{"x":760,"y":0},"end":{"x":940,"y":20},"thickness":20,"kind":"exterior","confidence":0.9},
    {"id":"w3","start":{"x":940,"y":20},"end":{"x":1130,"y":80},"thickness":20,"kind":"exterior","confidence":0.83},
    {"id":"w4","start":{"x":1130,"y":80},"end":{"x":1320,"y":190},"thickness":20,"kind":"exterior","confidence":0.83},
    {"id":"w5","start":{"x":1320,"y":190},"end":{"x":1470,"y":350},"thickness":20,"kind":"exterior","confidence":0.83},
    {"id":"w6","start":{"x":1470,"y":350},"end":{"x":1570,"y":540},"thickness":20,"kind":"exterior","confidence":0.83},
    {"id":"w7","start":{"x":1570,"y":540},"end":{"x":1640,"y":760},"thickness":20,"kind":"exterior","confidence":0.83},
    {"id":"w8","start":{"x":1640,"y":760},"end":{"x":1600,"y":960},"thickness":20,"kind":"exterior","confidence":0.83},
    {"id":"w9","start":{"x":1600,"y":960},"end":{"x":1520,"y":1160},"thickness":20,"kind":"exterior","confidence":0.83},
    {"id":"w10","start":{"x":1520,"y":1160},"end":{"x":1390,"y":1320},"thickness":20,"kind":"exterior","confidence":0.83},
    {"id":"w11","start":{"x":1390,"y":1320},"end":{"x":1210,"y":1440},"thickness":20,"kind":"exterior","confidence":0.83},
    {"id":"w12","start":{"x":1210,"y":1440},"end":{"x":980,"y":1510},"thickness":20,"kind":"exterior","confidence":0.83},
    {"id":"w13","start":{"x":980,"y":1510},"end":{"x":720,"y":1530},"thickness":20,"kind":"exterior","confidence":0.83},
    {"id":"w14","start":{"x":720,"y":1530},"end":{"x":500,"y":1490},"thickness":20,"kind":"exterior","confidence":0.83},
    {"id":"w15","start":{"x":500,"y":1490},"end":{"x":320,"y":1410},"thickness":20,"kind":"exterior","confidence":0.9},
    {"id":"w16","start":{"x":320,"y":1410},"end":{"x":180,"y":1290},"thickness":20,"kind":"exterior","confidence":0.9},
    {"id":"w17","start":{"x":180,"y":1290},"end":{"x":80,"y":1140},"thickness":20,"kind":"exterior","confidence":0.9},
    {"id":"w18","start":{"x":80,"y":1140},"end":{"x":30,"y":960},"thickness":20,"kind":"exterior","confidence":0.9},
    {"id":"w19","start":{"x":30,"y":960},"end":{"x":0,"y":760},"thickness":20,"kind":"exterior","confidence":0.9},
    {"id":"w20","start":{"x":0,"y":760},"end":{"x":70,"y":610},"thickness":20,"kind":"exterior","confidence":0.9},
    {"id":"w21","start":{"x":70,"y":610},"end":{"x":150,"y":500},"thickness":20,"kind":"exterior","confidence":0.9},
    {"id":"w22","start":{"x":150,"y":500},"end":{"x":150,"y":330},"thickness":20,"kind":"exterior","confidence":0.9},
    {"id":"w23","start":{"x":150,"y":330},"end":{"x":300,"y":330},"thickness":20,"kind":"exterior","confidence":0.9},
    {"id":"w24","start":{"x":300,"y":330},"end":{"x":300,"y":170},"thickness":20,"kind":"exterior","confidence":0.9},
    {"id":"w25","start":{"x":300,"y":170},"end":{"x":460,"y":170},"thickness":20,"kind":"exterior","confidence":0.9},
    {"id":"w26","start":{"x":460,"y":170},"end":{"x":460,"y":0},"thickness":20,"kind":"exterior","confidence":0.9},
    {"id":"w27","start":{"x":30,"y":800},"end":{"x":1600,"y":800},"thickness":12,"kind":"interior","confidence":0.76},
    {"id":"w28","start":{"x":500,"y":800},"end":{"x":500,"y":1490},"thickness":12,"kind":"interior","confidence":0.76},
    {"id":"w29","start":{"x":720,"y":800},"end":{"x":720,"y":1530},"thickness":12,"kind":"interior","confidence":0.76},
    {"id":"w30","start":{"x":980,"y":800},"end":{"x":980,"y":1510},"thickness":12,"kind":"interior","confidence":0.76},
    {"id":"w31","start":{"x":1200,"y":800},"end":{"x":1200,"y":1385},"thickness":12,"kind":"interior","confidence":0.76},
    {"id":"w32","start":{"x":180,"y":1050},"end":{"x":1520,"y":1050},"thickness":12,"kind":"interior","confidence":0.76},
    {"id":"w33","start":{"x":320,"y":1250},"end":{"x":1390,"y":1250},"thickness":12,"kind":"interior","confidence":0.76},
    {"id":"w34","start":{"x":150,"y":500},"end":{"x":720,"y":500},"thickness":12,"kind":"interior","confidence":0.76},
    {"id":"w35","start":{"x":300,"y":170},"end":{"x":300,"y":610},"thickness":12,"kind":"interior","confidence":0.76},
    {"id":"w36","start":{"x":460,"y":0},"end":{"x":460,"y":500},"thickness":12,"kind":"interior","confidence":0.76},
    {"id":"w37","start":{"x":720,"y":500},"end":{"x":720,"y":800},"thickness":12,"kind":"interior","confidence":0.76},
    {"id":"w38","start":{"x":500,"y":1050},"end":{"x":500,"y":1250},"thickness":12,"kind":"interior","confidence":0.76},
    {"id":"w39","start":{"x":980,"y":1050},"end":{"x":980,"y":1250},"thickness":12,"kind":"interior","confidence":0.76},
    {"id":"w40","start":{"x":1200,"y":1050},"end":{"x":1200,"y":1250},"thickness":12,"kind":"interior","confidence":0.76},
    {"id":"w41","start":{"x":320,"y":1250},"end":{"x":320,"y":1410},"thickness":12,"kind":"interior","confidence":0.76}
  ],"doors":[
    {"id":"d1","wallId":"w23","position":0.55,"width":90,"type":"single","confidence":0.76},
    {"id":"d2","wallId":"w34","position":0.80,"width":90,"type":"single","confidence":0.83},
    {"id":"d3","wallId":"w27","position":0.34,"width":90,"type":"single","confidence":0.89},
    {"id":"d4","wallId":"w27","position":0.44,"width":90,"type":"single","confidence":0.82},
    {"id":"d5","wallId":"w27","position":0.58,"width":90,"type":"single","confidence":0.86},
    {"id":"d6","wallId":"w27","position":0.72,"width":90,"type":"single","confidence":0.82},
    {"id":"d7","wallId":"w32","position":0.27,"width":85,"type":"single","confidence":0.79},
    {"id":"d8","wallId":"w32","position":0.48,"width":85,"type":"single","confidence":0.79},
    {"id":"d9","wallId":"w32","position":0.68,"width":85,"type":"single","confidence":0.82},
    {"id":"d10","wallId":"w32","position":0.86,"width":85,"type":"single","confidence":0.79},
    {"id":"d11","wallId":"w33","position":0.23,"width":80,"type":"single","confidence":0.72},
    {"id":"d12","wallId":"w33","position":0.52,"width":80,"type":"single","confidence":0.72},
    {"id":"d13","wallId":"w33","position":0.78,"width":80,"type":"single","confidence":0.72},
    {"id":"d14","wallId":"w8","position":0.55,"width":90,"type":"single","confidence":0.74}
  ],"windows":[
    {"id":"win1","wallId":"w1","position":0.52,"width":120,"type":"standard","confidence":0.83},
    {"id":"win2","wallId":"w3","position":0.55,"width":150,"type":"standard","confidence":0.73},
    {"id":"win3","wallId":"w5","position":0.55,"width":170,"type":"standard","confidence":0.70},
    {"id":"win4","wallId":"w9","position":0.55,"width":160,"type":"standard","confidence":0.74},
    {"id":"win5","wallId":"w12","position":0.52,"width":160,"type":"standard","confidence":0.78},
    {"id":"win6","wallId":"w15","position":0.55,"width":150,"type":"standard","confidence":0.76},
    {"id":"win7","wallId":"w17","position":0.50,"width":140,"type":"standard","confidence":0.75},
    {"id":"win8","wallId":"w22","position":0.50,"width":130,"type":"standard","confidence":0.78}
  ],"furniture":[]}]
}