{"schemaVersion":"plan2world-draft-v1","name":"Wikimedia two-bedroom GPT-5.6 Sol reconstruction","units":"cm","scale":{"mode":"measured","confidence":0.92,"basis":"Used the visible overall 6900 mm lower width, 12000 mm depth, and 6500 mm upper width printed on the source raster."},"assumptions":["The 535×526 source makes several small door/window widths hard to read, so unlabeled opening widths are estimated.","The upper store/exit/kitchen partition geometry is reconstructed from the visible wall graph and dimension grid.","No furniture is inferred."],"sourceRegistration":{"floorId":"floor-0","confidence":0.84,"anchors":[{"wallId":"w1","endpoint":"start","image":{"x":0.326,"y":0.214}},{"wallId":"w1","endpoint":"end","image":{"x":0.620,"y":0.214}},{"wallId":"w4","endpoint":"end","image":{"x":0.639,"y":0.770}},{"wallId":"w8","endpoint":"start","image":{"x":0.325,"y":0.724}}]},"floors":[{"id":"floor-0","name":"Ground Floor","level":0,"walls":[{"id":"w1","start":{"x":0,"y":0},"end":{"x":650,"y":0},"thickness":20,"kind":"exterior","confidence":0.97},{"id":"w2","start":{"x":650,"y":0},"end":{"x":650,"y":400},"thickness":20,"kind":"exterior","confidence":0.94},{"id":"w3","start":{"x":650,"y":400},"end":{"x":690,"y":400},"thickness":20,"kind":"exterior","confidence":0.84},{"id":"w4","start":{"x":690,"y":400},"end":{"x":690,"y":1200},"thickness":20,"kind":"exterior","confidence":0.96},{"id":"w5","start":{"x":690,"y":1200},"end":{"x":340,"y":1200},"thickness":20,"kind":"exterior","confidence":0.93},{"id":"w6","start":{"x":340,"y":1200},"end":{"x":340,"y":1100},"thickness":20,"kind":"exterior","confidence":0.84},{"id":"w7","start":{"x":340,"y":1100},"end":{"x":0,"y":1100},"thickness":20,"kind":"exterior","confidence":0.92},{"id":"w8","start":{"x":0,"y":1100},"end":{"x":0,"y":0},"thickness":20,"kind":"exterior","confidence":0.97},{"id":"w9","start":{"x":0,"y":400},"end":{"x":340,"y":400},"thickness":12,"kind":"interior","confidence":0.95},{"id":"w10","start":{"x":0,"y":550},"end":{"x":170,"y":550},"thickness":12,"kind":"interior","confidence":0.89},{"id":"w11","start":{"x":0,"y":700},"end":{"x":340,"y":700},"thickness":12,"kind":"interior","confidence":0.95},{"id":"w12","start":{"x":170,"y":400},"end":{"x":170,"y":700},"thickness":12,"kind":"interior","confidence":0.89},{"id":"w13","start":{"x":340,"y":0},"end":{"x":340,"y":1100},"thickness":12,"kind":"interior","confidence":0.97},{"id":"w14","start":{"x":465,"y":0},"end":{"x":465,"y":245},"thickness":12,"kind":"interior","confidence":0.76},{"id":"w15","start":{"x":340,"y":245},"end":{"x":650,"y":245},"thickness":12,"kind":"interior","confidence":0.82},{"id":"w16","start":{"x":340,"y":400},"end":{"x":650,"y":400},"thickness":12,"kind":"interior","confidence":0.90},{"id":"w17","start":{"x":340,"y":550},"end":{"x":690,"y":550},"thickness":12,"kind":"interior","confidence":0.88},{"id":"w18","start":{"x":340,"y":1000},"end":{"x":690,"y":1000},"thickness":12,"kind":"interior","confidence":0.95}],"doors":[{"id":"d1","wallId":"w9","position":0.77,"width":90,"type":"single","confidence":0.84},{"id":"d2","wallId":"w12","position":0.25,"width":75,"type":"single","confidence":0.79},{"id":"d3","wallId":"w12","position":0.75,"width":75,"type":"single","confidence":0.79},{"id":"d4","wallId":"w11","position":0.77,"width":90,"type":"single","confidence":0.77},{"id":"d5","wallId":"w13","position":0.43,"width":90,"type":"opening","confidence":0.69},{"id":"d6","wallId":"w15","position":0.70,"width":90,"type":"single","confidence":0.63},{"id":"d7","wallId":"w16","position":0.50,"width":120,"type":"opening","confidence":0.73},{"id":"d8","wallId":"w18","position":0.50,"width":150,"type":"double","confidence":0.88},{"id":"d9","wallId":"w1","position":0.86,"width":90,"type":"single","confidence":0.76}],"windows":[{"id":"win1","wallId":"w1","position":0.18,"width":120,"type":"standard","confidence":0.84},{"id":"win2","wallId":"w8","position":0.18,"width":120,"type":"standard","confidence":0.80},{"id":"win3","wallId":"w8","position":0.82,"width":120,"type":"standard","confidence":0.84},{"id":"win4","wallId":"w7","position":0.50,"width":120,"type":"standard","confidence":0.79},{"id":"win5","wallId":"w2","position":0.72,"width":100,"type":"standard","confidence":0.77},{"id":"win6","wallId":"w4","position":0.42,"width":150,"type":"standard","confidence":0.85}],"furniture":[]}]}