{
  "schemaVersion": "plan2world-draft-v1",
  "name": "Blind sample 1 – decorated YJ215 apartment",
  "units": "cm",
  "scale": {
    "mode": "measured",
    "confidence": 0.94,
    "basis": "Used the printed millimetre dimension chains: the top/bottom horizontal chain totals about 22.10 m and the side chains about 13.3–13.4 m."
  },
  "assumptions": [
    "Furniture, floor textures, cabinetry and room labels are ignored as wall geometry unless reinforced by a continuous architectural wall stroke.",
    "Balcony edges and several shallow exterior steps are simplified into straight orthogonal segments.",
    "Opening widths are estimated where the decorative plan obscures jambs; main wall topology follows the dark structural strokes.",
    "No furniture is inferred."
  ],
  "sourceRegistration": {
    "floorId": "floor-0",
    "confidence": 0.86,
    "anchors": [
      {"wallId": "w1", "endpoint": "start", "image": {"x": 0.145, "y": 0.338}},
      {"wallId": "w7", "endpoint": "start", "image": {"x": 0.619, "y": 0.177}},
      {"wallId": "w12", "endpoint": "end", "image": {"x": 0.846, "y": 0.489}},
      {"wallId": "w20", "endpoint": "start", "image": {"x": 0.405, "y": 0.898}}
    ]
  },
  "floors": [{
    "id": "floor-0",
    "name": "Apartment",
    "level": 0,
    "walls": [
      {"id":"w1","start":{"x":180,"y":300},"end":{"x":650,"y":300},"thickness":20,"kind":"exterior","confidence":0.88},
      {"id":"w2","start":{"x":650,"y":300},"end":{"x":650,"y":240},"thickness":20,"kind":"exterior","confidence":0.88},
      {"id":"w3","start":{"x":650,"y":240},"end":{"x":980,"y":240},"thickness":20,"kind":"exterior","confidence":0.88},
      {"id":"w4","start":{"x":980,"y":240},"end":{"x":980,"y":180},"thickness":20,"kind":"exterior","confidence":0.88},
      {"id":"w5","start":{"x":980,"y":180},"end":{"x":1400,"y":180},"thickness":20,"kind":"exterior","confidence":0.88},
      {"id":"w6","start":{"x":1400,"y":180},"end":{"x":1400,"y":0},"thickness":20,"kind":"exterior","confidence":0.88},
      {"id":"w7","start":{"x":1400,"y":0},"end":{"x":1660,"y":0},"thickness":20,"kind":"exterior","confidence":0.88},
      {"id":"w8","start":{"x":1660,"y":0},"end":{"x":1660,"y":480},"thickness":20,"kind":"exterior","confidence":0.88},
      {"id":"w9","start":{"x":1660,"y":480},"end":{"x":1810,"y":480},"thickness":20,"kind":"exterior","confidence":0.88},
      {"id":"w10","start":{"x":1810,"y":480},"end":{"x":1810,"y":530},"thickness":20,"kind":"exterior","confidence":0.88},
      {"id":"w11","start":{"x":1810,"y":530},"end":{"x":2210,"y":530},"thickness":20,"kind":"exterior","confidence":0.88},
      {"id":"w12","start":{"x":2210,"y":530},"end":{"x":2210,"y":1120},"thickness":20,"kind":"exterior","confidence":0.88},
      {"id":"w13","start":{"x":2210,"y":1120},"end":{"x":1820,"y":1120},"thickness":20,"kind":"exterior","confidence":0.88},
      {"id":"w14","start":{"x":1820,"y":1120},"end":{"x":1820,"y":1220},"thickness":20,"kind":"exterior","confidence":0.88},
      {"id":"w15","start":{"x":1820,"y":1220},"end":{"x":1420,"y":1220},"thickness":20,"kind":"exterior","confidence":0.88},
      {"id":"w16","start":{"x":1420,"y":1220},"end":{"x":1420,"y":1340},"thickness":20,"kind":"exterior","confidence":0.88},
      {"id":"w17","start":{"x":1420,"y":1340},"end":{"x":700,"y":1340},"thickness":20,"kind":"exterior","confidence":0.88},
      {"id":"w18","start":{"x":700,"y":1340},"end":{"x":700,"y":1260},"thickness":20,"kind":"exterior","confidence":0.88},
      {"id":"w19","start":{"x":700,"y":1260},"end":{"x":0,"y":1260},"thickness":20,"kind":"exterior","confidence":0.88},
      {"id":"w20","start":{"x":0,"y":1260},"end":{"x":0,"y":900},"thickness":20,"kind":"exterior","confidence":0.88},
      {"id":"w21","start":{"x":0,"y":900},"end":{"x":180,"y":900},"thickness":20,"kind":"exterior","confidence":0.88},
      {"id":"w22","start":{"x":180,"y":900},"end":{"x":180,"y":300},"thickness":20,"kind":"exterior","confidence":0.88},
      {"id":"w23","start":{"x":180,"y":530},"end":{"x":1810,"y":530},"thickness":12,"kind":"interior","confidence":0.77},
      {"id":"w24","start":{"x":180,"y":900},"end":{"x":1820,"y":900},"thickness":12,"kind":"interior","confidence":0.77},
      {"id":"w25","start":{"x":650,"y":240},"end":{"x":650,"y":1260},"thickness":12,"kind":"interior","confidence":0.77},
      {"id":"w26","start":{"x":980,"y":180},"end":{"x":980,"y":900},"thickness":12,"kind":"interior","confidence":0.77},
      {"id":"w27","start":{"x":1400,"y":180},"end":{"x":1400,"y":1220},"thickness":12,"kind":"interior","confidence":0.77},
      {"id":"w28","start":{"x":1810,"y":530},"end":{"x":1810,"y":1120},"thickness":12,"kind":"interior","confidence":0.77},
      {"id":"w29","start":{"x":450,"y":300},"end":{"x":450,"y":530},"thickness":12,"kind":"interior","confidence":0.77},
      {"id":"w30","start":{"x":780,"y":240},"end":{"x":780,"y":530},"thickness":12,"kind":"interior","confidence":0.77},
      {"id":"w31","start":{"x":1180,"y":180},"end":{"x":1180,"y":530},"thickness":12,"kind":"interior","confidence":0.77},
      {"id":"w32","start":{"x":180,"y":700},"end":{"x":650,"y":700},"thickness":12,"kind":"interior","confidence":0.77},
      {"id":"w33","start":{"x":450,"y":530},"end":{"x":450,"y":1260},"thickness":12,"kind":"interior","confidence":0.77},
      {"id":"w34","start":{"x":650,"y":720},"end":{"x":980,"y":720},"thickness":12,"kind":"interior","confidence":0.77},
      {"id":"w35","start":{"x":780,"y":530},"end":{"x":780,"y":720},"thickness":12,"kind":"interior","confidence":0.77},
      {"id":"w36","start":{"x":980,"y":720},"end":{"x":1400,"y":720},"thickness":12,"kind":"interior","confidence":0.77},
      {"id":"w37","start":{"x":1180,"y":530},"end":{"x":1180,"y":900},"thickness":12,"kind":"interior","confidence":0.77},
      {"id":"w38","start":{"x":1400,"y":720},"end":{"x":1810,"y":720},"thickness":12,"kind":"interior","confidence":0.77},
      {"id":"w39","start":{"x":1600,"y":530},"end":{"x":1600,"y":900},"thickness":12,"kind":"interior","confidence":0.77},
      {"id":"w40","start":{"x":1820,"y":900},"end":{"x":1820,"y":1120},"thickness":12,"kind":"interior","confidence":0.77},
      {"id":"w41","start":{"x":1820,"y":1020},"end":{"x":2210,"y":1020},"thickness":12,"kind":"interior","confidence":0.77},
      {"id":"w42","start":{"x":2000,"y":530},"end":{"x":2000,"y":1120},"thickness":12,"kind":"interior","confidence":0.77},
      {"id":"w43","start":{"x":700,"y":1100},"end":{"x":1420,"y":1100},"thickness":12,"kind":"interior","confidence":0.77},
      {"id":"w44","start":{"x":980,"y":900},"end":{"x":980,"y":1340},"thickness":12,"kind":"interior","confidence":0.77}
    ],
    "doors": [
      {"id":"d1","wallId":"w12","position":0.28,"width":95,"type":"single","confidence":0.92},
      {"id":"d2","wallId":"w23","position":0.15,"width":85,"type":"single","confidence":0.79},
      {"id":"d3","wallId":"w23","position":0.35,"width":85,"type":"single","confidence":0.79},
      {"id":"d4","wallId":"w23","position":0.52,"width":85,"type":"single","confidence":0.84},
      {"id":"d5","wallId":"w23","position":0.71,"width":90,"type":"opening","confidence":0.78},
      {"id":"d6","wallId":"w24","position":0.22,"width":90,"type":"single","confidence":0.80},
      {"id":"d7","wallId":"w24","position":0.48,"width":90,"type":"single","confidence":0.86},
      {"id":"d8","wallId":"w24","position":0.72,"width":90,"type":"single","confidence":0.83},
      {"id":"d9","wallId":"w25","position":0.43,"width":85,"type":"single","confidence":0.72},
      {"id":"d10","wallId":"w26","position":0.45,"width":85,"type":"single","confidence":0.76},
      {"id":"d11","wallId":"w27","position":0.36,"width":90,"type":"opening","confidence":0.73},
      {"id":"d12","wallId":"w27","position":0.68,"width":90,"type":"single","confidence":0.77},
      {"id":"d13","wallId":"w28","position":0.55,"width":90,"type":"single","confidence":0.85},
      {"id":"d14","wallId":"w41","position":0.48,"width":85,"type":"single","confidence":0.74},
      {"id":"d15","wallId":"w42","position":0.42,"width":85,"type":"single","confidence":0.76}
    ],
    "windows": [
      {"id":"win1","wallId":"w1","position":0.52,"width":150,"type":"standard","confidence":0.83},
      {"id":"win2","wallId":"w7","position":0.50,"width":150,"type":"standard","confidence":0.86},
      {"id":"win3","wallId":"w8","position":0.50,"width":150,"type":"standard","confidence":0.82},
      {"id":"win4","wallId":"w13","position":0.50,"width":150,"type":"standard","confidence":0.82},
      {"id":"win5","wallId":"w16","position":0.50,"width":180,"type":"standard","confidence":0.82},
      {"id":"win6","wallId":"w19","position":0.50,"width":180,"type":"standard","confidence":0.84},
      {"id":"win7","wallId":"w20","position":0.50,"width":180,"type":"standard","confidence":0.81},
      {"id":"win8","wallId":"w22","position":0.55,"width":140,"type":"standard","confidence":0.77}
    ],
    "furniture": []
  }]
}